{
  "schema_version": "phase15.vox.1.0",
  "project": "crowdwisdom-hermes-video-ads",
  "title": "Phase 15: Cinematic Vox Visual Journalism Storyboard",
  "target_runtime_seconds": 45.0,
  "creative_system": {
    "system_a_company_art": "Official Paper Diorama Prompt System (halftone B&W cutouts, white keylines, offset red strokes, archival palette)",
    "system_b_vox_grammar": "Narration-driven visual journalism (every sentence has a visual argument, transformation, 2.5D depth)",
    "system_c_research_story": "Grounding in Meta ads research, retail trader ICP pain points, and verified proprietary data"
  },
  "scenes": [
    {
      "scene_id": "scene_01",
      "start": 0.0,
      "end": 5.0,
      "narration": "At 2:17 AM, a lone trader sits in the dark. The screen flashes red.",
      "visual_argument": "A solitary trader isolated in a dark void while market monitors flash alert warnings.",
      "visual_metaphor": "A solitary human island surrounded by an ocean of nocturnal market volatility.",
      "style_mode": "LOCKED_STAGE",
      "background": "Muted archival newsprint grid, charcoal parchment texture, double keyline border.",
      "midground": "B&W halftone cutout trader at workstation, rough white keyline, offset red marker shadow.",
      "foreground": "Giant bold condensed numerals '2:17 AM' stamping into frame with ALERT_WASH and offset red stroke.",
      "company_style_components": [
        "halftone black-and-white cutout",
        "rough white keyline",
        "offset red marker stroke",
        "condensed bold headline caps",
        "ALERT_WASH",
        "archival tan palette"
      ],
      "vox_visual_components": [
        "VOX_HOOK",
        "VOX_VISUAL_ARGUMENT",
        "VOX_PHOTO_CUTOUT",
        "VOX_2_5D_CAMERA"
      ],
      "camera_move": "slow creeping push-in on trader's eyes",
      "depth": "Front numeral plane at Z: +200px, trader subject at Z: 0px, archival newsprint wall at Z: -400px.",
      "transition_in": "Hard cut from black void with immediate audio sub-bass punch.",
      "transformation": "The flashing red numeral colon ':' pulses and transforms into the blinking cursor of a live newsfeed terminal.",
      "transition_out": "Match-cut on monitor cursor into cascading headline layers.",
      "sound_events": [
        "sub-bass pulse",
        "mechanical clock tick",
        "deep newsroom room tone"
      ],
      "approved_text": [
        "2:17 AM",
        "THE MARKET NEVER SLEEPS"
      ],
      "approved_numbers": [
        "2:17 AM"
      ]
    },
    {
      "scene_id": "scene_02",
      "start": 5.0,
      "end": 10.0,
      "narration": "Traders don't have an information problem. They are drowning in fourteen thousand alerts a minute.",
      "visual_argument": "Information physically overwhelms the trader, stacking endless layers of text, charts, and news clips until the screen is choked with noise.",
      "visual_metaphor": "A suffocating blizzard of financial paperwork burying the trader.",
      "style_mode": "DEEP_DIORAMA",
      "background": "Cascading financial newsprint columns, tape strips, and microfiche overlays.",
      "midground": "B&W halftone trader cutout physically shrinking in scale as stacks of alert cards spring pop-up with overshoot.",
      "foreground": "Flying red warning triangles, broken trendlines, and newsprint fragments crossing close to the lens.",
      "company_style_components": [
        "aged-print collage textures",
        "halftone black-and-white cutouts",
        "spring pop-ups with overshoot",
        "print-grain finish",
        "ALERT_WASH"
      ],
      "vox_visual_components": [
        "VOX_VISUAL_ARGUMENT",
        "VOX_VISUAL_METAPHOR",
        "VOX_INFORMATION_BUILD",
        "VOX_EDITORIAL_COLLAGE",
        "VOX_2_5D_CAMERA"
      ],
      "camera_move": "fast lateral track then hard stop with overshoot",
      "depth": "Extreme shallow DOF: flying foreground debris Z: +350px, trader midground Z: 0px, 4-tier newsprint backdrop Z: -600px.",
      "transition_in": "Match-cut on cursor expanding into flying data cards.",
      "transformation": "Newspaper headline 'BREAKING MARKET COLLAPSE' tears down the middle (TEAR), the torn edge becoming a jagged red trendline.",
      "transition_out": "Whip-track following the jagged trendline.",
      "sound_events": [
        "rapid paper rustle",
        "accelerating ticks",
        "track rumble",
        "drain hiss"
      ],
      "approved_text": [
        "TOO MUCH INFORMATION",
        "RATE: 14,000 ALERTS / MINUTE",
        "ALERT: NOISE FLOOD"
      ],
      "approved_numbers": []
    },
    {
      "scene_id": "scene_03",
      "start": 10.0,
      "end": 15.0,
      "narration": "They have a signal problem. When every feed screams panic, where is the truth?",
      "visual_argument": "All conflicting arrows, charts, and headlines suddenly collapse toward one central point of focus, exposing the emptiness of the noise.",
      "visual_metaphor": "Noise collapsing into a singular gravity well.",
      "style_mode": "FLAT_PARALLAX",
      "background": "Flat archival tan canvas with faint faded coordinate lines.",
      "midground": "Conflicting red and mustard directional arrows vibrating and canceling each other out, collapsing into center.",
      "foreground": "Bold condensed typography 'NOT ENOUGH SIGNAL', stamped red underline swipe.",
      "company_style_components": [
        "aged-newsprint collage surface",
        "desaturated archival palette",
        "red underline swipes",
        "COUNTER_SLAM",
        "THREAD_PULL"
      ],
      "vox_visual_components": [
        "VOX_VISUAL_ARGUMENT",
        "VOX_VISUAL_METAPHOR",
        "VOX_INFORMATION_COLLAPSE",
        "VOX_KINETIC_TYPE",
        "VOX_TRANSFORMATION"
      ],
      "camera_move": "slow drift lateral",
      "depth": "Flat multi-plane parallax: foreground text Z: +120px, midground arrows Z: 0px, background grid Z: -250px.",
      "transition_in": "Sudden inward contraction of surrounding noise cards.",
      "transformation": "Red marker underline pulls tight like a thread (THREAD_PULL) and snaps into a horizontal baseline coordinate on a global map.",
      "transition_out": "Baseline coordinate expands into latitude/longitude grid.",
      "sound_events": [
        "rubber creak",
        "stall click",
        "deep sub thud",
        "room tone falling to near silence"
      ],
      "approved_text": [
        "NOT ENOUGH SIGNAL",
        "DATA STATUS: COGNITIVE OVERLOAD"
      ],
      "approved_numbers": []
    },
    {
      "scene_id": "scene_04",
      "start": 15.0,
      "end": 21.0,
      "narration": "CrowdWisdom doesn't guess. It indexes 1,482,930 trader inputs in real time across the globe.",
      "visual_argument": "Hundreds of individual trader cutouts light up across a tactile paper map, each feeding a red signal thread into a central convergence hub.",
      "visual_metaphor": "Thousands of human whispers aggregating into a single resounding voice.",
      "style_mode": "DEEP_DIORAMA",
      "background": "Archival aged topographic map of global financial capitals with textured paper grain.",
      "midground": "Multiple B&W halftone cutouts of traders across Tokyo, London, and New York, linked by glowing red vector lines.",
      "foreground": "Giant stat counter '1,482,930' ticking up aggressively with spring pop-up overshoot (TICK_UP).",
      "company_style_components": [
        "halftone black-and-white cutout people",
        "giant stat numbers",
        "ticking counters",
        "rough white keylines",
        "offset hot-red strokes",
        "TICK_UP"
      ],
      "vox_visual_components": [
        "VOX_DATA_EXPLANATION",
        "VOX_MAP_SEQUENCE",
        "VOX_PHOTO_CUTOUT",
        "VOX_TRANSFORMATION",
        "VOX_2_5D_CAMERA"
      ],
      "camera_move": "dive through a layer",
      "depth": "3D diorama Z-depth: giant numerals Z: +250px, trader cutouts at varying depths Z: -100px to +50px, map terrain Z: -500px.",
      "transition_in": "Camera dives through the paper map surface as nodes illuminate.",
      "transformation": "The last digit '0' of 1,482,930 expands outward into a circular radar scope.",
      "transition_out": "Radar sweep reveals comparative benchmark cards.",
      "sound_events": [
        "submerge whoosh",
        "deep pressure hum",
        "mechanical counter ticks",
        "paper pops"
      ],
      "approved_text": [
        "1,482,930",
        "TRADER INPUTS",
        "UNIFIED REAL-TIME MARKET CONVERGENCE"
      ],
      "approved_numbers": [
        "1,482,930 trader inputs"
      ]
    },
    {
      "scene_id": "scene_05",
      "start": 21.0,
      "end": 28.0,
      "narration": "Delivering 68.4% directional accuracy\u2014tested, verified, and proven across four hundred twenty-eight tickers.",
      "visual_argument": "A giant dual-card statistical proof stage comparing CrowdWisdom's 68.4% accuracy directly against market noise.",
      "visual_metaphor": "A precision balance scale locking into undeniable equilibrium.",
      "style_mode": "LOCKED_STAGE",
      "background": "Locked archival parchment canvas with faint microfiche grid and double border keyline.",
      "midground": "Stat card '68.4%' stamping down (STAMP) with an offset red marker keyline, beside ticker tags.",
      "foreground": "Bold black condensed headline 'DIRECTIONAL ACCURACY' with a mustard annotation label.",
      "company_style_components": [
        "giant stat numbers",
        "condensed bold headline caps",
        "STAMP",
        "offset red marker stroke",
        "secondary mustard annotation"
      ],
      "vox_visual_components": [
        "VOX_DATA_EXPLANATION",
        "VOX_EDITORIAL_COLLAGE",
        "VOX_VISUAL_ARGUMENT",
        "VOX_2_5D_CAMERA"
      ],
      "camera_move": "slow drift lateral",